"Сука, я ніхуя не встигну перекласти ці йобані тексти за 2 дні."
Українська термінологія - це піздєц.
а мені нравПросто гріх дрищів не падйобувать
"[городити хуйню про грамотність жахливо неграмотними і українською, і російською мовами: вишенька на тортику цієї феєрії]"
"До деяких людей не виникає інших питань, окрім ""Ти блять уже родився таким мудаком?""."
"Знайому запросили гуляти двоє пацанів.Один - крутий чувак, з афігєнним почуттям гумору, інший - егоїстичне мудло."
"Давно на землю спустився демон, який захотів змучити людство та придумав він, блять, переїзди."
" ба-ссуха, блять. там одна ""с"", дятел"
"І блять, навколо якісь діти і вони хочу бухати і вони про це пишуть."
"блять, забув на вписці зарядку від ноута. попереду 11годинний робочий день. сука.сука.сука"
"Ти сукан, бухаєш без нас з "
На колір та смак товариш не всякДля когось і Хакслі - хуйовий автор
"але спочатку то було не все одно, знач ти намагався не класти хуй, а це вже шось"
"Дякую за зауваження)Пиздити мене треба, щоб менше пизділа!"
"Та нахєр блядь то всьо, всі сука сцять бути відповідальним і накатати ту заяву до ректора."
"Кидайте цю милоту будь якому руснявому гівну, що почне патякати за те як на Сколєнії жить харашо."
"Отримала нині міні-інфаркт, бо думала, що він мені нахуй дзеркало знесе."
Батюшка сказав шо митрополит-це наш пастир до Спасіння а митрополітен-це якась хуйня з рельсами яка веде у Теремки
Бля ця херея ще й двигається
"бляха, як же мені прикро, що все так ;("
Я викину цю кончену картку в Стікс блять
"це коли карент муд від ""мудак"""
"Таке враження, шо в росії не вміють норм трахатись."
"словом, заїбало то всьо. ви кто такіє? я вас нє звал. ідітє нахуй"
Мужик що проходив мимо зацінив мою сраку.
"А при Януковичі ти, хуй, так само робив?"
